{
  "format": {
    "extension": ".luxshow",
    "version": "0.2.0"
  },
  "show": {
    "id": "show-001",
    "name": "Untitled Show",
    "duration_ms": 240000,
    "mode": "design",
    "bpm": 128,
    "sample_rate": 48000,
    "loop": false
  },
  "assets": [],
  "devices": [
    {
      "id": "pump-01",
      "kind": "pump",
      "protocol": "modbus_tcp",
      "address": {
        "host": "192.168.1.10",
        "port": 502
      },
      "capabilities": [],
      "safety": {
        "default_state": "stop",
        "requires_pressure_ok": true,
        "requires_water_ok": true,
        "max_speed": null
      }
    }
  ],
  "patch": {
    "nodes": [
      {
        "id": "node-master-pump",
        "type": "pump",
        "label": "Master Pump Array",
        "position": {
          "x": 160,
          "y": 100
        },
        "size": {
          "width": 180,
          "height": 80
        },
        "ports": {
          "in": [
            "trigger"
          ],
          "out": [
            "flow"
          ]
        },
        "params": {
          "speed": 75
        },
        "binding": {
          "protocol": "modbus_tcp",
          "device_id": "pump-01",
          "status": "online"
        }
      }
    ],
    "connections": []
  },
  "timeline": [
    {
      "id": "track-1",
      "label": "Master Pump",
      "type": "pump",
      "color": "#00d4ff",
      "device_id": "pump-01",
      "muted": false,
      "solo": false,
      "clips": [
        {
          "id": "clip-1",
          "start_ms": 0,
          "end_ms": 16000,
          "label": "Intro Surge",
          "intensity": 0.6,
          "behavior": {
            "preset_id": null,
            "easing": "linear",
            "blend": "replace",
            "loop": false,
            "parameters": {}
          },
          "safety_class": "normal",
          "tags": []
        }
      ],
      "automation": []
    }
  ],
  "safety_rules": [],
  "calibration_profile": {},
  "ui": {
    "timelineZoom": 4,
    "showGrid": true
  },
  "compile": {
    "compiled_at": "2026-05-29T08:32:58.159066+00:00",
    "target_runtime": "lux-runtime-core",
    "validated": true,
    "signature": "2c3f8868fbcbd9b9f1dd06251f5995914ee11a42b76c253da3bdedadda3d0ad8",
    "source_format": "prototype-aqua"
  }
}